IRI,label,original_definition,enriched_definition,modified
https://www.commoncoreontologies.org/ont00000802,Stage,An Entertainment Facility that is designed to provide a space upon which entertaining performances or productions can occur.,"An Entertainment Facility that is designed to provide a designated performance area where actors, musicians, dancers, or other performers present live entertainment to an audience.",True
https://www.commoncoreontologies.org/ont00000881,Storage Facility,A Facility that is designed to store materials or goods.,"A Facility that is designed to house, contain, and preserve materials, goods, or other artifacts for future use or distribution.",True
https://www.commoncoreontologies.org/ont00000757,Synagogue,A Religious Facility that is designed for Judaic worship and prayer.,"A religious facility that is designed to bear the function of facilitating Jewish worship, prayer, and religious instruction.",True
https://www.commoncoreontologies.org/ont00001165,Terrorist Training Camp,A Training Camp designed to teach students methods of terrorism.,"A training camp that is designed to teach students methods, techniques, and tactics for conducting acts of terrorism.",True
https://www.commoncoreontologies.org/ont00000330,Thermal Power Plant,An Electric Power Station that is designed to convert heat energy into electrical energy.,"A facility that is designed to convert thermal energy into electrical energy through the use of heat sources such as fossil fuels, nuclear reactions, or geothermal energy to generate steam or hot gases that drive turbines connected to electrical generators.",True
https://www.commoncoreontologies.org/ont00000332,Training Camp,"A Facility that is designed for rigorous and focused training in order to learn or improve skills, usually involving physical actions.",A Facility that is designed to enable intensive and systematic training activities aimed at developing or enhancing specific skills or capabilities through structured instruction and practice.,True
https://www.commoncoreontologies.org/ont00000226,Transportation Facility,"A Facility that is designed for commencing or concluding the transportation of transportation artifacts, or for housing transportation artifacts.","A Facility that is designed to enable the beginning or ending of transportation processes involving transportation artifacts, or to provide storage or maintenance space for transportation artifacts.",True
https://www.commoncoreontologies.org/ont00000271,Underground Mine,A Mine that is designed to support the extraction of materials from the ground using underground tunnels and shafts.,"A mine that is designed to enable the extraction of materials from subsurface locations through the use of subterranean tunnels, shafts, and chambers.",True
https://www.commoncoreontologies.org/ont00000104,Underwater Mine,A Mine that is designed to support the extraction of materials from the ocean floor.,A facility that is designed to support the extraction of materials from the ocean floor.,True
https://www.commoncoreontologies.org/ont00000375,Warehouse,A Storage Facility that is designed to store commercial goods.,A storage facility that is designed to store large quantities of commercial goods and materials for distribution or sale.,True
https://www.commoncoreontologies.org/ont00001375,Washing Facility,A Facility that is designed to wash personnel or equipment.,A facility that is designed to enable the cleaning of personnel or equipment through the application of water and cleaning agents.,True
https://www.commoncoreontologies.org/ont00001315,Waste Management Facility,A Facility that is designed for managing waste for some portion of the waste's existence.,"A Facility that is designed to collect, process, treat, store, or dispose of waste materials during one or more phases of the waste lifecycle.",True
https://www.commoncoreontologies.org/ont00000708,Water Tower,A Facility that is the bearer of functions realized in processes of storing water in an elevated container.,A Facility that is designed to store water in an elevated container and is the bearer of functions that are realized in processes of storing and distributing water through gravitational pressure.,True
https://www.commoncoreontologies.org/ont00000814,Water Treatment Facility,A Facility that is designed for making water more acceptable for a specific end-use.,"A Facility that is designed to process water through physical, chemical, or biological methods to remove contaminants and improve water quality for a designated end-use purpose.",True
https://www.commoncoreontologies.org/ont00000381,Weapon Manufacturing Facility,A Factory that is designed to produce or assemble weapons.,A manufacturing facility that is designed to produce or assemble weapons.,True
https://www.commoncoreontologies.org/ont00000882,Wind Farm,An Electric Power Station that is designed to convert the wind's kinetic energy into electrical power by means of wind turbines.,An Electric Power Station that is designed to convert kinetic energy from wind into electrical energy by means of multiple wind turbines arranged across a designated area.,True
